{
  "format": 1,
  "name": "Vital Marketplace",
  "issued": "2026-10-05T00:00:00Z",
  "items": [
    {
      "id": "celluloid",
      "name": "Celluloid",
      "summary": "A small GTK video player.",
      "description": "Celluloid plays local video and audio through mpv. It is part of the curated Vital OS set. The catalog icon is original.",
      "version": "system",
      "category": "Media",
      "publisher": "Celluloid contributors",
      "homepage": "https://celluloid-player.github.io/",
      "license": "GPL-3.0-or-later",
      "install": {
        "method": "apt",
        "package": "celluloid"
      },
      "min_os_version": "0.1.0",
      "icon": {
        "url": "bundled://icons/media.svg",
        "sha256": "ec2e5087bc21b0b948b76d2acdc6276ff7412b4ae86aeb39ee4d0903409da48d"
      },
      "screenshots": [],
      "checksum": "06413b94768d3baa804d1371e286cc368ee784834fa33588d405099066898483"
    },
    {
      "id": "firefox",
      "name": "Firefox",
      "summary": "Web browser from Mozilla's apt archive.",
      "description": "Firefox is already part of the Vital OS image, installed from packages.mozilla.org rather than a snap. Marketplace can reinstall it with apt if it has been removed. The icon in this catalog is an original Vital tile, not the Firefox logo.",
      "version": "system",
      "category": "Internet",
      "publisher": "Mozilla",
      "homepage": "https://www.mozilla.org/firefox/",
      "license": "MPL-2.0",
      "install": {
        "method": "apt",
        "package": "firefox"
      },
      "min_os_version": "0.1.0",
      "icon": {
        "url": "bundled://icons/web.svg",
        "sha256": "907a8d99a5a0192213888ebbaa8ee90829bad5124ae4989a5502a5faf016705b"
      },
      "screenshots": [],
      "checksum": "3f353baf60e322bb4e7a891c74b05992769009fe968d4d099e6e610643475e05"
    },
    {
      "id": "gimp",
      "name": "GIMP",
      "summary": "Image editor, installed from Flathub.",
      "description": "GNU Image Manipulation Program. Vital Marketplace installs the Flathub build org.gimp.GIMP. Flathub must be reachable the first time. The catalog icon is an original tile, not the GIMP mascot.",
      "version": "flathub",
      "category": "Graphics",
      "publisher": "The GIMP team",
      "homepage": "https://www.gimp.org/",
      "license": "GPL-3.0-or-later",
      "install": {
        "method": "flatpak",
        "flatpak_id": "org.gimp.GIMP"
      },
      "min_os_version": "0.1.0",
      "icon": {
        "url": "bundled://icons/graphics.svg",
        "sha256": "43378af7614c00c2b58d120c36f62bd03d9bf65f8c98e88218acb4e080afa322"
      },
      "screenshots": [],
      "checksum": "095d8992143a9be51cd0c8bcfb54b77868669a71c163d27e5673f504dd4fc905"
    },
    {
      "id": "inkscape",
      "name": "Inkscape",
      "summary": "Vector drawing, installed from Flathub.",
      "description": "Inkscape edits SVG drawings. Vital Marketplace installs org.inkscape.Inkscape from Flathub. The catalog icon is original.",
      "version": "flathub",
      "category": "Graphics",
      "publisher": "The Inkscape team",
      "homepage": "https://inkscape.org/",
      "license": "GPL-2.0-or-later",
      "install": {
        "method": "flatpak",
        "flatpak_id": "org.inkscape.Inkscape"
      },
      "min_os_version": "0.1.0",
      "icon": {
        "url": "bundled://icons/draw.svg",
        "sha256": "0750766b662117e0af37f539b87a19ff160215b018709edcf9e2266e6a21f424"
      },
      "screenshots": [],
      "checksum": "78cce8a077ed4754bd1994a48ed9cb56109f0e26d7a5e5094923c77dc361e56f"
    },
    {
      "id": "vital-example-note",
      "name": "Vital Example Note",
      "summary": "Example script. It prints one line and changes nothing.",
      "description": "This entry exists so the script installer can be reviewed. It is not a product. Marketplace shows the script and asks before it runs. The helper downloads it again and refuses it if the SHA-256 does not match. A .deb would use the same url and sha256 fields with method deb.",
      "version": "0.1.0",
      "category": "Examples",
      "publisher": "Vital OS",
      "homepage": "https://github.com/taltol15/vital-os",
      "license": "GPL-3.0-or-later",
      "install": {
        "method": "script",
        "url": "bundled://examples/vital-demo-note.sh",
        "sha256": "f987cbd9f870a513ad46ff21824769f27eede70a0174529b7cc304e06692a19f"
      },
      "example": true,
      "min_os_version": "0.1.0",
      "icon": {
        "url": "bundled://icons/example.svg",
        "sha256": "de734f21beea944dbe5925ffec76bc2911f21fd1a6688bce2471693a084db112"
      },
      "screenshots": [],
      "checksum": "1eef10798cb62c6cca8d26b48b024328f7080f1ea5e9426abf002edeac0468ce"
    }
  ]
}
